Date,News Article Title
2023-09-01,"Apple's Big Moves: Trademark Settlement, iPhone 15 Reveal, and 3D Printing Trials"
2023-09-01,Should You Buy the Dow Stock Outperforming Apple?
2023-09-01,"Here are Friday’s biggest analyst calls: Amazon, Dell, Apple, Chevron, Broadcom, Tesla and more"
2023-09-02,2 Spectacular Warren Buffett Stocks to Buy in September
2023-09-02,"Top Stock Market Highlights of the Week: Frasers Centrepoint Trust, Apple’s Launch Event and Hotel Properties Limited"
2023-09-02,Here's why stocks may surprise to the upside in September
2023-09-03,3 Mega-Cap Stocks to Buy in September
2023-09-03,0
2023-09-03,0
2023-09-04,Is There Now An Opportunity In Apple Inc. (NASDAQ:AAPL)?
2023-09-04,Apple’s (NASDAQ:AAPL) Upcoming Launch Event: The Ultimate Litmus Test
2023-09-04,"Buy, Sell or Hold? My Calls on the ‘Magnificent 7’ Stocks"
2023-09-05,A Bull Market Could Be Here: 2 Reasons to Buy Apple Stock
2023-09-05,AAPL: Apple Stock Drops 4% in Worst Month of 2023. iPhone 15 Launch Expected Sept 12.
2023-09-05,Warren Buffett’s 3 Must-Hold Stocks for Long-Term Investors
2023-09-06,Unveiling Apple (AAPL)'s Value: Is It Really Priced Right? A Comprehensive Guide
2023-09-06,Goldman Sachs Says Buy Apple Stock Ahead of the Upcoming September Event
2023-09-06,"These Stocks Moved the Most Today: Apple, AMC, First Solar, and More"
2023-09-07,Apple Stock: Should You Buy the Dip Ahead of Tuesday's iPhone 15 Launch?
2023-09-07,Should You Buy Apple (AAPL) Stock?
2023-09-07,"Nasdaq tumbles as Apple losses deepen, Fed's next move in focus: Stock market news today"
2023-09-08,Reality Is Creeping In on the Nasdaq’s Yearlong Dream Rally
2023-09-08,Apple Stock Springs Back From Two-Day Dive On Reassuring Analyst Comments
2023-09-08,Apple's stock is the biggest short for investor Dan Niles amid worries about China's iPhone ban
2023-09-09,"Apple: iPhone 15, Understand Its Pricing Strategy"
2023-09-09,iOS vs Android Market Share by Country: Top 30 Countries Using iPhones
2023-09-09,Downgrading Apple On Rising China Geopolitical Risk: The Supply Chain Threat
2023-09-10,Where Will Apple Stock Be in 3 Years?
2023-09-10,"1 Stock to Buy, 1 Stock to Sell This Week: Oracle, Apple"
2023-09-10,Apple Just Shed More Than $230 Billion In Market Cap. Here's Why It's a Buying Opportunity.
2023-09-11,"Apple Stock: Buy, Sell, or Hold?"
2023-09-11,Apple Stock Rises. Why Tech Names From Tesla to Nvidia Can Breathe a Sigh of Relief.
2023-09-11,Magnificent Seven' investing playbook: Is Apple a growth company anymore?
2023-09-12,Apple's (AAPL) iPhone 15 Launch: What to Expect
2023-09-12,"Markets News, Sept. 12, 2023: Stocks Fall on Apple's iPhone 15 Release, Rising Oil Prices"
2023-09-12,"Apple, NVIDIA And Other Tech Stocks From Wall Street's Most Accurate Analysts"
2023-09-13,Apple Stock’s (NASDAQ:AAPL) Recent Dip: A Lovely Gift
2023-09-13,Concerning News for Apple Stock Investors
2023-09-13,Apple Investors Already Hate The New iPhone 15 More Than Ever
2023-09-14,Apple Stock Is Finally Heading To Where I Think It Belongs
2023-09-14,"Institutional investors in Apple Inc. (NASDAQ:AAPL) see US$136b decrease in market cap last week, although long-term gains have benefitted them."
2023-09-14,Apple Stock (NASDAQ:AAPL): The iPhone 15 Will Prove a Flourishing Successor
2023-09-15,Apple Unleashes The World's First Smartphone With A '3 Nm' Processor (NASDAQ:AAPL)
2023-09-15,Apple iPhone 15 launch: an inflection point for Wall Street?
2023-09-15,Does The iPhone 15 Pro Have A 'Discoloration' Issue? First Hands-On Photos Suggest It Is A Fingerprint Magnet
2023-09-16,Morgan Stanley Pounds the Table on Apple Stock
2023-09-16,The Next Apple? 3 Tech Stocks That Can Hand You 10X Returns
2023-09-16,0
2023-09-17,Analyst: Apple Stock Could Soar to $240
2023-09-17,Warren Buffett's AI Bets: 46.1% of Berkshire Hathaway's $353 Billion Stock Portfolio Is Held in These 2 Artificial Intelligence (AI) Growth Stocks
2023-09-17,0
2023-09-18,Apple Stock Rises On Reports Of Strong iPhone 15 Pro Demand
2023-09-18,Qualcomm and Apple Forge Ahead with New Modem Partnership
2023-09-18,"If You Invested In Apple Stock Instead Of Buying iPhones Each Year, Here's How Much You'd Have Today"
2023-09-19,Microsoft Eyes Apple’s Spot as World’s Largest Stock
2023-09-19,2 Leading Tech Stocks to Buy in 2023 and Beyond
2023-09-19,Microsoft Is Gradually Closing In on Apple as It Eyes Position as World’s Largest Stock
2023-09-20,Apple Inc (AAPL): A Deep Dive into Its Financial Metrics and Competitive Strengths
2023-09-20,Initial Demand For Apple's iPhone 15 Handsets Called 'Mixed At Best'
2023-09-20,Apple Stock: Bull vs. Bear
2023-09-21,"Tesla and Apple Have This 1 Trait in Common, and It’s Making Investors Rich"
2023-09-21,Here's Everything iPhone 15 Pro Can Do With The New USB-C Port That Older iPhones Could Not
2023-09-21,0
2023-09-22,Is Apple (NASDAQ:AAPL) A Risky Investment?
2023-09-22,Apple Stock: One Good Reason To Be Cautious In The Short Term
2023-09-22,"Tesla CEO Elon Musk Is So Impressed By Apple's iPhone 15 Photos That He Tells Tim Cook, 'I'm Buying One'"
2023-09-23,Daniel Ives Pounds the Table on Apple Stock
2023-09-23,Did You Know About iPhone 15's Charger's 'Handshake' Trick? Marques Brownlee Reveals Something Interesting
2023-09-23,APPLE stock price closed at $174.84 today
2023-09-24,Is It Too Late to Buy Apple Stock?
2023-09-24,Apple: A potential Autumn windfall
2023-09-24,Prediction: Here's How Much Apple Will Be Worth in 2030
2023-09-25,Why Apple's (AAPL) iPhone 15 Will Boost 2024 Revenue
2023-09-25,Apple (NASDAQ:AAPL) Rises on Strong iPhone Demand
2023-09-25,Apple's 'Made In India' Production Could Surge To $40 Billion in the Coming Years
2023-09-26,3 Warren Buffett Stocks Worth Owning Forever
2023-09-26,"Repairing iPhone 15 Pro's Back Glass Is 3x Cheaper, But It Is Shockingly Fragile"
2023-09-26,Caution! 3 Stocks That Could Get Rocked as Student Loan Payments Restart.
2023-09-27,Apple (AAPL) Stock Sinks As Market Gains: What You Should Know
2023-09-27,"5 Years, 20 Quarters: The ONLY Stock Buffett Has Consistently Bought (Not Apple!)"
2023-09-27,Apple (NASDAQ:AAPL) Yet to Comply with New Chinese App Store Rule
2023-09-28,Is Apple Stock a Buy Now?
2023-09-28,Apple Stock Is Set for the Worst Month of the Year. This iPhone Problem Isn’t Helping.
2023-09-28,Will Apple’s (NASDAQ:AAPL) iPhone 15 Pro Issues Jeopardize Sales?
2023-09-29,What Should Investors Do With Apple (AAPL) Stock End of September?
2023-09-29,Apple (NASDAQ:AAPL) Plans Huge Ramp-Up in AI
2023-09-29,Megacap Slump Is Testing Apple’s Safe-Haven Status
2023-09-30,7 S&P 500 Stocks Set to Explode Higher
2023-09-30,"Keep eyes peeled for Apple, TLT inflection points, BTIG's Krinsky says"
2023-09-30,0
2023-10-01,Apple Stock Is at 4-Month Lows and Looks Attractive to Value Investors
2023-10-01,Apple to take action on overheating iPhone 15s
2023-10-01,"New iPhones Feeling The Heat? Apple Blames Software And Apps, Assures Solutions"
2023-10-02,Will iPhone 15 Issues Harm Apple (NASDAQ:AAPL) Stock?
2023-10-02,"Apple Is a Magnificent Stock, But There Are 2 Big Reasons Investors Could Regret Buying It Right Now"
2023-10-02,Apple iPhone 15 Pro Lead Times Shorten As Supply Catches Up With Demand
2023-10-03,Apple (AAPL) Stock Moves -0.78%: What You Should Know
2023-10-03,Good News for Apple (NASDAQ:AAPL) Can’t Prevent a Small Loss
2023-10-03,Apple Stock Near All-Time High; Tops Growth Stocks Benchmark
2023-10-04,Those who invested in Apple (NASDAQ:AAPL) five years ago are up 217%
2023-10-04,Huge Insider Selling at Apple (NASDAQ:AAPL) Prompts Concern
2023-10-04,Apple Stock Is Falling After a Downgrade. 4 Reasons for Caution.
2023-10-05,Is Apple (NASDAQ:AAPL) Using Too Much Debt?
2023-10-05,Where Will Apple Stock Be in 10 Years?
2023-10-05,"Rich Dad, Poor Dad' Author Robert Kiyosaki Says 'Time To Buy Apple' If Stock Drops Below This Level"
2023-10-06,Is Apple Stock a Buy After Its Selloff?
2023-10-06,"Microsoft Stock, Analysts Predict Double-Digit Upside"
2023-10-06,Apple Stock Needs a Win. Here Are 2 Big Ideas.
2023-10-07,Is It Too Late to Buy Apple Stock?
2023-10-07,"Forget Disney. Apple (NASDAQ:AAPL) Should Buy Nintendo to Jolt iPhone, Vision Pro Sales"
2023-10-07,Here's How Every iPhone 15 Model Fared After 100 Test Drops On A Stone Surface
2023-10-08,"Forget Disney. Apple (NASDAQ:AAPL) Should Buy Nintendo to Jolt iPhone, Vision Pro Sales"
2023-10-08,"These Stocks Turned $10,000 Into $13 Million (or More) and Are Not Done Rising Yet"
2023-10-08,3 Stocks to Add to Your Portfolio in a Market Pullback
2023-10-09,Apple (NASDAQ:AAPL) Might be Hit Hard in Google Trial
2023-10-09,Eyes on Apple (AAPL): Is Now a Smart Time to Buy Tech?
2023-10-09,Apple (AAPL) Rises Higher Than Market: Key Facts
2023-10-10,Apple (NASDAQ:AAPL) Risks Litigation in Ongoing Google Antitrust Case
2023-10-10,3 Stocks That Can Help Build Generational Wealth for Patient Investors
2023-10-10,0
2023-10-11,A Look At The Intrinsic Value Of Apple Inc. (NASDAQ:AAPL)
2023-10-11,Apple's iPhone Is A Teenage Love Affair That Shows No Sign Of Fading: What A Survey Reveals
2023-10-11,"Is Apple Priced to Perfection, Based on Its Current P/E?"
2023-10-12,A Bull Market is Coming: 2 Warren Buffett Favorites to Buy Now
2023-10-12,Interesting Way to Beat Magnificent Seven
2023-10-12,"1 Green Flag for Apple in 2023, and 1 Red Flag"
2023-10-13,Apple CEO Tim Cook Just Sold $88 Million Worth of Stock. Has the Stock Peaked?
2023-10-13,Ignore Tim Cook’s Insider Selling and Keep Doubling Down on AAPL Stock
2023-10-13,AAPL Stock: Could this Options Combination Trade Unlock a Large Profit?
2023-10-14,Apple Stock (NASDAQ:AAPL): What to Look for In Its Q4 Results
2023-10-14,3 Reasons to Buy Apple Stock and Never Sell
2023-10-14,Next In Line: iPhone 16 Pro's Potential Features Revealed
2023-10-15,Apple Inc. (NASDAQ:AAPL) is largely controlled by institutional shareholders who own 55% of the company
2023-10-15,"Down 10% From Highs, Should You Buy Apple Stock?"
2023-10-15,Buffett’s Successors: 3 Stocks the Next Generation of Billionaires Are Buying
2023-10-16,Apple stock falls on reports Huawei gaining bigger-than-expected market share in China
2023-10-16,Jeffries Analyst Warns of Dip in Apple’s (NASDAQ:AAPL) Chinese Sales
2023-10-16,Why investors should block out the noise on Apple ahead of earnings
2023-10-17,Apple Stock (NASDAQ:AAPL): Be Careful as Reality Starts to Set In
2023-10-17,Apple (NASDAQ:AAPL) Slips amid Growing iPhone Availability
2023-10-17,"META, AMZN, or AAPL: Which Mega-Cap Tech Stock Do Analysts Find the Most Attractive?"
2023-10-18,Apple (NASDAQ:AAPL) Up Fractionally despite Nightmare MacBook Report
2023-10-18,Apple bonds are yielding more than 5%. The stock has a 0.5% dividend yield.
2023-10-18,Deka launches Nasdaq-100 ETF with competitive TER
2023-10-19,Apple Investors Face $340 Billion Hole as Woes Mount
2023-10-19,"Apple Stock: Buy, Sell, or Hold?"
2023-10-19,2 Green Flags for Apple's Future
2023-10-20,Apple (NASDAQ:AAPL) CEO Tim Cook Gets Warm Reception in China Tour
2023-10-20,Apple Stock Falls Again. What’s Behind the Losing Streak.
2023-10-20,Warren Buffett's Billion-Dollar Dividend Duo: Apple and Coca-Cola Account For Over $1.6 Billion A Year In Income For Berkshire Hathaway
2023-10-21,"3 Stocks That Turned $1,000 Into $1.1 Million (or More)"
2023-10-21,"Big Nasdaq-100 Stocks Sell Off To Support Levels: Apple, NVIDIA, Tesla"
2023-10-21,3 Top Stocks To Buy Now and Hold Forever
2023-10-22,0
2023-10-22,0
2023-10-22,0
2023-10-23,Is It Time To Consider Buying Apple Inc. (NASDAQ:AAPL)?
2023-10-23,Apple (NASDAQ:AAPL) Isn’t Out of the Woods on iPhone Demand Yet
2023-10-23,Why Is Apple (AAPL) Stock Down Today?
2023-10-24,Growing China Risks Don’t Faze Apple (NASDAQ:AAPL) Investors
2023-10-24,"3 AI Stocks to Buy Now to Turn $5,000 Into $15,000"
2023-10-24,Apple set to report earnings next week — Here’s what Wall Street expects
2023-10-25,Apple (NASDAQ:AAPL): This “Magnificent Seven” Stock is Too Unloved
2023-10-25,Apple Stock Gets Price-Target Cut On Softening iPhone 15 Sales
2023-10-25,47.6% of Warren Buffett's $335 Billion Portfolio Is Invested in 2 Artificial Intelligence (AI) Stocks
2023-10-26,Will Apple’s (NASDAQ:AAPL) Watch Sales Come Under Pressure?
2023-10-26,Apple Makes Up Almost 50% of Warren Buffett's Portfolio: Is the Stock a Buy?
2023-10-26,1 Simple Reason Warren Buffett Prefers to Buy Apple Rather Than Tesla Stock
2023-10-27,Apple (NASDAQ:AAPL) Seems To Use Debt Quite Sensibly
2023-10-27,Masimo boosted with patent win over Apple Watch
2023-10-27,Tim Cook Is Sending Warren Buffett $855 Million Right Now
2023-10-28,Can Apple Stock Double in 5 Years? Here's What It Would Take.
2023-10-28,0
2023-10-28,0
2023-10-29,"Weekly Preview: Earnings to Watch This Week 10-29-23 (AMD, AAPL, MRNA, SQ)"
2023-10-29,"Earnings week ahead: Apple, AMD, Pfizer, McDonald's, Starbucks and more"
2023-10-29,"Some Big Tech Stocks Are Still Expensive, But This Analyst Says They're Worth It. Here's Why"
2023-10-30,Here’s Why Apple (AAPL) Fell in Q3
2023-10-30,Dow Jones Anticipates Federal Reserve Meeting And Apple Earnings Report
2023-10-30,These 3 Stocks Might Be Getting a Little Too Expensive
2023-10-31,Nasdaq 100 forecast: How will Apple earnings impact AAPL stock?
2023-10-31,Apple (NASDAQ:AAPL) Q4 Earnings: Will Hardware Sales Disappoint?
2023-10-31,Analyzing Apple (AAPL) Stock Before Earnings
2023-11-01,Is Apple Stock a Buy?
2023-11-01,"Apple Weather App Can't Handle Snow: Bug Shows A File Icon, And People Are Making Fun Of It"
2023-11-01,Jim Cramer says Apple and Nvidia are ‘the two worst’ stock charts
2023-11-02,Apple (AAPL) Q4 2023 Earnings: What to Expect
2023-11-02,"Apple Earnings: iPhone, Services Sales and China in Focus Ahead of Key Report"
2023-11-02,Apple (AAPL) Q4 2023 earnings rise and beat Street View; iPhone sales rise
2023-11-03,Why Did Apple (AAPL) Drop on an Earnings Beat?
2023-11-03,"Dow Jones Futures Rise, Apple Falls On Holiday Outlook; Jobs Report Due"
2023-11-03,Wall Street Reacts to Apple’s (NASDAQ:AAPL) Q4 Earnings
2023-11-04,Apple Inc. (NASDAQ:AAPL) Q4 2023 Earnings Call Transcript
2023-11-04,Apple's (NASDAQ:AAPL) five-year earnings growth trails the impressive shareholder returns
2023-11-04,The Apple Inc (AAPL) Company: A Short SWOT Analysis
2023-11-05,Apple's wishy-washy guidance; AMD's AI optimism: Weekly tech roundup
2023-11-05,7 Tech Stocks to Buy and Hold for the Next 25 Years
2023-11-05,0
2023-11-06,2 Reasons Apple Stock Is a Buy Today
2023-11-06,Does Apple (AAPL) Face Geopolitical Risk?
2023-11-06,The Apple Is Getting Moldy
2023-11-07,Should Investors Buy Apple Stock on the Dip?
2023-11-07,Apple CEO Tim Cook's 6 Words That Could Point to a Higher-Growth Future for the Tech Giant
2023-11-07,Assessing the Ownership Landscape of Apple Inc(AAPL)
2023-11-08,Apple (NASDAQ:AAPL) Could Allow Third-Party App Stores
2023-11-08,Here’s Why You Should Consider Increasing Your Apple (AAPL) Stake
2023-11-08,3 Top Tech Stocks to Buy in November
2023-11-09,Apple: Dead Money At Best
2023-11-09,AAPL Stock: Should You Buy the Apple Dip?
2023-11-09,Morgan Stanley Says Buy Apple Stock as It Becomes a True ‘AI Enabler’
2023-11-10,Calculating The Intrinsic Value Of Apple Inc. (NASDAQ:AAPL)
2023-11-10,Prediction: Microsoft Will Overtake Apple as the World's Largest Company By 2025
2023-11-10,"Market Clubhouse Morning Memo - November 10th, 2023 (Trade Strategy For SPY, QQQ, AAPL, MSFT, NVDA, GOOGL, TSLA, And META)"
2023-11-11,Are You Single? China's Singles' Day Could Propel These Major Stocks
2023-11-11,Apple Stock: Bull vs. Bear
2023-11-11,Apple’s Top iPhone Supplier Goes to Outer Space With New Satellites
2023-11-12,Apple Stock: The Good and Bad News for AAPL Investors
2023-11-12,How to create your own luck to catch the next rally out of nowhere
2023-11-12,Why Washington wants to treat Apple and Google like big banks
2023-11-13,Apple (NASDAQ:AAPL) Stock: An Under-the-Radar AI Play
2023-11-13,"5 big analyst AI moves: Piper’s high conviction in Adobe, Edge AI a plus for Apple"
2023-11-13,The 3 Best Robinhood Stocks for Beginning Investors
2023-11-14,Why Apple Cash Neutrality Policy Will Lead To Massive Shareholder Returns
2023-11-14,3 Meme Stocks That Are Here for the Long Haul
2023-11-14,Here's How You Can Get Apple Watch Ultra 2 For Free
2023-11-15,Better Buy: Amazon vs. Apple
2023-11-15,Alphabet CEO confirms Google payments to rival Apple of over US$10bn
2023-11-15,New Offer of Emergency Satellite for iPhone 14s Boosts Apple (NASDAQ:AAPL)
2023-11-16,Qualcomm (NASDAQ:QCOM) Gains as Apple (NASDAQ:AAPL) Fights to Make a Modem
2023-11-16,"With 55% ownership in Apple Inc. (NASDAQ:AAPL), institutional investors have a lot riding on the business"
2023-11-16,3 Large-Cap Tech Stocks to Toss Now
2023-11-17,Apple (AAPL) Declined on iPhone Ban by Chinese Government
2023-11-17,Apple Inc. (AAPL) vs. Dell Technologies (DELL) - November Forecast
2023-11-17,3 Reasons to Buy AAPL Stock Even After Its Fourth Consecutive Sales Decline
2023-11-18,Is Apple Stock a Buy Now?
2023-11-18,Where Will Apple Stock Be in 3 Years?
2023-11-18,Elon Musk Takes Swipe At IBM: Here's How He Responds To Post Asking If Company Pulled Ads From TikTok Amid Bin Laden Support
2023-11-19,Apple Gets a New Street-High Price Target
2023-11-19,A secret about the riches Apple extracts from Google spills into the open
2023-11-19,The Magnificent Seven Are Looking Magnificent In November
2023-11-20,Apple Has Still Not Released A Fix For The Flipper Zero iPhone Bluetooth Hack
2023-11-20,"Qualcomm Has $36B Year, Big Plans for AI"
2023-11-20,Penn Entertainment (PENN) Stock Gains on Analyst Upgrade
2023-11-21,"Apple (NASDAQ:AAPL): Boring, But Commands Massive Pricing Power"
2023-11-21,2 Growth Stocks to Buy Before the Big Bull Rally
2023-11-21,"Apple, Google Wanted A 'Deep, Deep Partnership' And To 'Work As If We Are One Company'"
2023-11-22,Apple Stock (NASDAQ:AAPL): Can Siri Keep Up in the ChatGPT Age?
2023-11-22,Apple to relocate Fair Oaks Mall store to nearby Fairfax Corner
2023-11-22,Apple (NASDAQ:AAPL) Gains as Morgan Stanley Praises the App Store
2023-11-23,Will Apple’s (NASDAQ:AAPL) iPhone Sales Tick Higher in Q4?
2023-11-23,3 Things About Apple That Smart Investors Know
2023-11-23,2 stocks that will guarantee returns in the long run
2023-11-24,Apple's iPhone 15 Thrives Despite Huawei Competition: Analyst Predicts Continued Success Into 2024
2023-11-24,Apple Stock: Headed to $240?
2023-11-24,"Huawei, Xiaomi EV Launches Could Inspire Apple (NASDAQ:AAPL)"
2023-11-25,When Should You Buy Apple Inc. (NASDAQ:AAPL)?
2023-11-25,"AAPL, AMZN, or NVDA: Which ""Strong Buy"" Mega-Cap Tech Stock Could Deliver the Best Returns?"
2023-11-25,"Apple's iPhone 15 Boosts Global Smartphone Sales, Ending 27-month Decline: Report"
2023-11-26,Better Tech Stock: Alphabet vs. Apple
2023-11-26,Goldman Sachs’ Top 5 Stock Picks for 2024
2023-11-26,Elon Musk Tells Adult Performer Why NSFW Accounts On X Can't Get Paid On Mobile But Via Web Only
2023-11-27,"Apple Stock: Golden Opportunity at Play, Says Dan Ives"
2023-11-27,Apple’s Growth Stalemate: 3 Reasons to Start Diversifying Away From AAPL Stock
2023-11-27,"Apple ID Hack And Phone Number Change Leave Users Without iCloud, No Help From iPhone Maker"
2023-11-28,Is Apple an Underrated AI Stock to Buy Right Now?
2023-11-28,"Apple Stock: Buy, Sell, or Hold?"
2023-11-28,"Could Microsoft Become the Most Important Stock in the Nasdaq, S&P 500, and Dow?"
2023-11-29,These 4 Measures Indicate That Apple (NASDAQ:AAPL) Is Using Debt Reasonably Well
2023-11-29,Apple (NASDAQ:AAPL) and Goldman Sachs Sever Credit Card Partnership
2023-11-29,Nasdaq Bear Market: 2 Stocks I'm Buying During a Recession
2023-11-30,"Apple Stock Fell Last Week, Analysts Say This Is The Perfect Opportunity To Buy"
2023-11-30,GTA Trilogy Lands On Netflix Games: Here's How You Can Pre-Register To Play On iPhone And Android
2023-11-30,Cognizant Technology Solutions to lay off employees tied to Apple in Austin
2023-12-01,Apple (NASDAQ:AAPL) Gains Slightly Due to Smartwatch Win
2023-12-01,Are Apple & Paramount Teaming Up? Potential Bundle Deal Could Shake Up Streaming Wars
2023-12-01,2 Tech Dividend Stocks to Buy and Hold Forever
2023-12-02,"25 Huge Companies That Apple Could Buy Right Now, With Cash"
2023-12-02,Paramount: Is Apple Ready To Buy This Streaming Kingmaker?
2023-12-02,"Barron's Weekend Stock Picks: Uber Joins The S&P 500, Schwab Rebounds And What's Next for Johnson & Johnson?"
2023-12-03,"If You Can Only Buy One Long-Term Stock in December, It Better Be One of These 3 Names"
2023-12-03,0
2023-12-03,0
2023-12-04,Apple (NASDAQ:AAPL) Remains Top Tech Pick at Wedbush
2023-12-04,2 Reasons to Buy Apple Stock Like There's No Tomorrow
2023-12-04,"Foxconn, Pegatron suspend iPhone production in Chennai as cyclone approaches"
2023-12-05,"Decoding Apple’s Stock Trajectory: Time to Buy, Hold, or Sell AAPL?"
2023-12-05,Will Microsoft Overtake Apple as the World's Largest Company in 2024?
2023-12-05,Billionaire Ken Fisher Pours Billions Into 2 ‘Magnificent Seven’ Stocks — Apple and Microsoft
2023-12-06,Apple (NASDAQ:AAPL) Stock Reclaims $3 Trillion Market Cap; What Comes Next?
2023-12-06,"If You Invested $1,000 In Dogecoin On Jan. 1, 2021, Here's How Much You'd Have Now"
2023-12-06,PayPal’s (NASDAQ:PYPL) “Quantum Leap” to Fight Apple and Stripe
2023-12-07,Is Apple (AAPL) Giving Buy or Sell Signals for December?
2023-12-07,"Apple at a $3 Trillion Market Cap: Buy, Sell, or Hold?"
2023-12-07,Is Apple (AAPL) Still a Worthy Investment Pick?
2023-12-08,5 Things to Know Before The Stock Market Opens
2023-12-08,Apple (NASDAQ:AAPL) Moves to Expand Production in India and Vietnam
2023-12-08,Apple's Market Cap Might Be Way Bigger Than Google's — But Which Tech Giant Delivered Better Stock Returns This Year?
2023-12-09,Would You Dare to Invest in Apple (AAPL)?
2023-12-09,"If You Invested $1,000 In Microsoft When Windows 2.0 Was Launched, Here's How Much You'd Have Today"
2023-12-09,5 No-Brainer Stocks to Buy Before 2024
2023-12-10,Is Apple Stock a Buy for 2024?
2023-12-10,"1 Artificial Intelligence (AI) Stock Set to Join Apple, Amazon, Microsoft, Alphabet, and Nvidia in the $1 Trillion Club"
2023-12-10,12 Dow Stocks Billionaires Like The Most
2023-12-11,Wedbush is Bullish on Apple (NASDAQ:AAPL) amid Strong iPhone Demand
2023-12-11,Apple could reach four trillion dollar market cap next year - analysts
2023-12-11,Apple could reach four trillion dollar market cap next year - analysts
2023-12-12,Is Apple Stock a Buy Now?
2023-12-12,Will Apple Be a $4 Trillion Stock in 2024?
2023-12-12,Apple’s (NASDAQ:AAPL) Tap-and-Go Tech Opens Up to Competitors
2023-12-13,Here’s What to Expect From Apple Stock in 2024
2023-12-13,"Apple Stock Price Prediction in 2030: Bull, Base & Bear Forecasts"
2023-12-13,Apple 2024: the world's most valuable company has its share of concerns
2023-12-14,Where Will Apple Stock Be in 5 Years?
2023-12-14,MSFT vs. AAPL: Which Stock Has More AI Upside Potential?
2023-12-14,Apple could outperform yet again in 2024: Citi
2023-12-15,Apple stock slips on report China is ramping up iPhone ban efforts
2023-12-15,Tech stocks gaining momentum in new bull market: analysts
2023-12-15,"Chinese Ban On Apple Devices Expands, Apple Shares Fall"
2023-12-16,0
2023-12-16,0
2023-12-16,0
2023-12-17,China Widens Apple’s (NASDAQ:AAPL) iPhone Ban
2023-12-17,Buy Apple Stock in the Down Months. You’ll Be Glad You Did.
2023-12-17,Will Nvidia Be Worth More Than Apple by 2030?
2023-12-18,The Other Apple Stock That Pays A Monthly Dividend With A 5.7% Yield
2023-12-18,"Midday movers: Apple, Netflix and more"
2023-12-18,"Apple's going to $4 trillion, Dan Ives declares; shares fall (AAPL)"
2023-12-19,"2024 Predictions For Apple, Tesla, 'Magnificent 7' And Musk From Analyst Dan Ives: It's AI's '1995 Moment'"
2023-12-19,11 Most Promising AI Stocks According to Hedge Funds
2023-12-19,0
2023-12-20,Apple To Hit $4 Trillion Market Cap In 2024? Why Analyst Calls Now The 'Golden Opportunity' To Own The Stock
2023-12-20,"AAPL, AMD, or AMZN: Which “Strong Buy” Tech Stock Could Offer the Highest Upside?"
2023-12-20,"Magnificent 7' Widens Gap With Rest Of S&P 500, But That May Change In 2024"
2023-12-21,Apple Set For A Market Surge In 2024 (Technical Analysis) (NASDAQ:AAPL)
2023-12-21,"Apple (NASDAQ:AAPL) Steps Up Vision Pro Production, Eyes February Launch"
2023-12-21,6 Reasons to Avoid Apple Stock (AAPL) Today
2023-12-22,"Tim Cook Better Than Satya Nadella And Sundar Pichai Combined? Look At Apple, Microsoft, and Google's Returns On $1000 Since These CEOs Took Charge"
2023-12-22,"2 Reasons to Buy Apple Stock, and 1 Reason to Sell"
2023-12-22,How to Buy Apple Stock in 2024
2023-12-23,"Dow Jones Giants Apple, Microsoft Lead Five Stocks Near Buy Points"
2023-12-23,"Apple Stock Could Hit $250, Says Daniel Ives"
2023-12-23,"Is It Time to Sell This Warren Buffett ""Magnificent Seven"" Stock Before 2024?"
2023-12-24,Apple (AAPL) Fell on Restrictions from China
2023-12-24,Apple Executives Spill The Beans: Here's Why The iPhone Maker's Chips Outshine Rivals
2023-12-24,0
2023-12-25,3 Stocks to Buy as the Nasdaq 100 Hits New All-Time High
2023-12-25,Will Apple stock reach $300 in 2024
2023-12-25,0
2023-12-26,Should You Buy Apple Stock in 2024?
2023-12-26,AAPL Stock Alert: The Apple Watch Ban Just Took Effect
2023-12-26,2 Warren Buffett Stocks to Buy Hand Over Fist and 1 to Avoid
2023-12-27,"US stocks edge higher; jobless claims rise, Apple gains"
2023-12-27,Apple (NASDAQ:AAPL) Slips despite Apple Watch Win
