Date,News Article Title
2023-12-27,Apple Pauses Watch Sale Due to Technology Dispute. What Should You Do With the Stock?
2023-12-28,Apple opens higher after US smartwatch import ban paused
2023-12-28,"Apple's iPhones Were Backdoored For Four Years Using The 'Most Sophisticated Attack Chain' Ever, Say Security Researchers"
2023-12-28,Apple's Chinese Partner Luxshare Set to Transform iPhone Production Landscape with Major Acquisition
2023-12-29,"Legendary Investor Jim Rogers Predicts Market Bubble, Positions To Short Tesla, Apple And Other 'Magnificent Seven'"
2023-12-29,The Top 7 Stocks to Buy Before They Take Off Next Year
2023-12-29,Apple Is the American Company People Quit the Fastest
2023-12-30,"Foldable Phones Battle For Market Share: Samsung Leads, Apple Absent"
2023-12-30,2 Best Warren Buffett Stocks to Buy for the Long Haul
2023-12-30,0
2023-12-31,2 FAANG Stocks to Buy in 2024 and 1 to Avoid
2023-12-31,0
2023-12-31,0
2024-01-01,80% of Warren Buffett's Portfolio Is Invested in These 7 Stocks as 2023 Begins
2024-01-01,0
2024-01-01,0
2024-01-02,3 Reasons Apple Stock Keeps Falling
2024-01-02,Ken Fisher’s Top 15 Growth Stock Picks
2024-01-02,"Apple Kills Beloved Dark Sky Weather App, Here Are Several Worthy Alternatives"
2024-01-03,"Why Apple Stock Dropped on Jan. 3, 2023"
2024-01-03,5 reasons why Apple stock could surge in 2023
2024-01-03,10 Best Stock Traders In Congress In 2022 (Spoiler: Nancy Pelosi Isn't No. 1)
2024-01-04,Apple Stock: You Have Been Warned Again
2024-01-04,7 Fun Facts About Apple Stock In 2022
2024-01-04,INTC Stock: Intel’s problems likely to persist this year and beyond
2024-01-05,Samsung's Consumer-Products Chief And Analysts Expect Demand Headwinds To Improve From 2H 2023
2024-01-05,7 Cheap Tech Stocks to Buy Before the Next Breakout
2024-01-05,7 Seriously Undervalued Large-Cap Stocks to Buy Now
2024-01-06,"You Could've Become a Millionaire With Just $1,000 Invested in This Warren Buffett Stock"
2024-01-06,"Apple Stock: Santa Claus Disappointed, But What’s Next?"
2024-01-06,Apple Pay Later: What's The Game Plan For Monetization?
2024-01-07,Better Buy: Tesla vs. Apple
2024-01-07,3 Compelling Reasons Why Amazon Stock Is a Smarter Pick Than Apple in 2023
2024-01-07,Cathie Wood Sees Tesla Stock Hitting $500 By 2026 Even Without Autonomous Driving & Ride-Hailing Service
2024-01-08,0
2024-01-08,0
2024-01-08,0
2024-01-09,Apple Stock: Further Declines Likely (NASDAQ:AAPL)
2024-01-09,"The iPhone Was Unveiled 16 Years Ago, Here's How Much $1,000 Invested In Apple Stock After The Debut Is Worth Today"
2024-01-09,Filings: Apple now intends to pour at least $240M into expansion of NW Austin campus
2024-01-10,The 3 Best Funds to Buy for a Roth IRA
2024-01-10,The 7 Best Mutual Funds for Your 401k
2024-01-10,The Top 5 Stocks Bought by Congress in 2022
2024-01-11,Apple vs. Microsoft: Which Tech Stock To Own In 2023?
2024-01-11,"40+ Apple statistics 2024: AAPL stock, revenue and performance"
2024-01-11,Viral TikTok Video Shows You How To Deliver Perfect Shots Of Moon On iPhone 14
2024-01-12,3 Reasons to Buy Apple Stock in 2023
2024-01-12,Why Apple CEO Tim Cook Is Staring At A Big Pay Cut In 2023
2024-01-12,Mobile Gaming Stocks: 10 Biggest Companies in 2024
2024-01-13,Why The Bottom Could Be In For Apple
2024-01-13,Techs Take On Apple And The Real World With Augmented Reality
2024-01-13,See every stock trade House Speaker Nancy Pelosi's husband has made since 2021
2024-01-14,0
2024-01-14,0
2024-01-14,0
2024-01-15,0
2024-01-15,0
2024-01-15,0
2024-01-16,2 FAANG Stocks to Buy in 2023 and 1 to Avoid: Here's Why
2024-01-16,0
2024-01-16,0
2024-01-17,Not all ‘Growth’ is the same – macro analysis
2024-01-17,The U.S. Companies With the Most to Lose From China’s Shrinking Population
2024-01-17,"Goldman Sachs Disappoints in Difficult Environment, Scales Back Consumer Focus, Shares Sink in Early Trading"
2024-01-18,Apple Stock: What The Charts Suggest Might Happen Next
2024-01-18,Masimo Wins Legal Round Against Apple
2024-01-18,Goldman Sachs CEO David Solomon Talks Up Apple Relationship
2024-01-19,Apple: Best Smartphone Stock Of 2023 (Rating Upgrade)
2024-01-19,The Top 7 “Millionaire-Maker” Long-Term Stocks for 2023
2024-01-19,Emerging Markets May Present Opportunities In 2023
2024-01-20,The Global Smartphone Market Just Fell Off a Cliff. Apple Beat the Odds.
2024-01-20,Where Will Apple Stock Be In 2030? (NASDAQ:AAPL)
2024-01-20,Apple: Pay Attention To These Key Numbers On Q1 Earnings Day
2024-01-21,"If I’d invested £500 in Apple shares 2 years ago, here’s how much money I’d have now"
2024-01-21,"Forget gold, I'm using the Warren Buffett method to try and get rich!"
2024-01-21,"How to Read Stocks: Charts, Basics and What to Look For"
2024-01-22,0
2024-01-22,0
2024-01-22,0
2024-01-23,Why Warren Buffett Wants Apple Stock to Tumble
2024-01-23,"Apple Executives Sold Stock in 2022, but Tim Cook Held Off"
2024-01-23,Apple’s 2024 Outlook: 2 Game-Changing AAPL Stock Catalysts to Watch
2024-01-24,Apple earnings to serve as a clearing event - Morgan Stanley
2024-01-24,Apple (AAPL) vs. Dell Technologies (DELL): Buy or Sell Potential
2024-01-24,Apple at a Crossroads: Why AAPL Stock Is Still Poised for Pivotal Growth
2024-01-25,Apple Stock (NASDAQ:AAPL) Could Impress as Vision Pro Launch Looms
2024-01-25,Bull of the Day: Apple (AAPL)
2024-01-25,Apple (NASDAQ:AAPL) Plans New Policies for Downloads
2024-01-26,"Apple's Sales Are Falling, but This Area of Its Business Has Grown 25% in Just 2 Years"
2024-01-26,Apple (NASDAQ:AAPL) Overhauls App Store Policies in the EU
2024-01-26,Apple to add third-party app stores for EU iPhones
2024-01-27,Where Will Apple Stock Be in 5 Years?
2024-01-27,"If You Invested $1000 In Apple When The iPad Was Launched 14 Years Ago, Here's How Much You'd Have Today"
2024-01-27,"Stock Market Curveball: Apple, IBM, and Netflix Just Split Their Stocks, but It's Not What You Think"
2024-01-28,"Weekly Preview: Earnings To Watch (AMZN, AAPL, GOOG, META, MSFT)"
2024-01-28,0
2024-01-28,0
2024-01-29,Apple Stock (NASDAQ:AAPL): Vision Pro Is a Potential Silver Lining
2024-01-29,"Microsoft Set To Leapfrog Apple In Market Value In The Next Five Years, Investors Predict"
2024-01-29,Investors see Microsoft's stock market value leaving Apple behind
2024-01-30,Apple Q1 Earnings Preview: Will AAPL Become a $3 Trillion Stock Again?
2024-01-30,Apple (AAPL) Earnings Analysis: Buy or Watch for Gains?
2024-01-30,AAPL Stock Alert: Why Now May Be the Perfect Time to Take a Bite of Apple
2024-01-31,4 Reasons to Buy Apple Stock Like There's No Tomorrow
2024-01-31,A Massive Problem With Apple Stock Today
2024-01-31,"Move Over, Apple -- Microsoft Is the New Largest Company in the World"
2024-02-01,Apple (AAPL) Q1 2024 Earnings: What to Expect
2024-02-01,Apple (NASDAQ:AAPL) Slips despite Q1 Earnings Beat
2024-02-01,"Apple, Amazon and Meta Take Spotlight"
2024-02-02,Apple Stock Plunges Despite Tim Cook's 'Big AI Plans' In 2024
2024-02-02,Apple Inc. (NASDAQ:AAPL) Q1 2024 Earnings Call Transcript
2024-02-02,Here's How Much Apple Stock Gained in Each Year Since the iPhone Launched in 2007
2024-02-03,Tim Cook's AI Efforts Have Wedbush's Dan Ives Excited: 'We View Apple Like Meta 18 Months Ago'
2024-02-03,Could Apple Acquire Peloton in 2024? 2 Things Investors Should Know About the Rumors
2024-02-03,"From Meta, Microsoft And Other Tech Titans Uniting Against Apple To Elon Musk Mocking Vision Pro: Your Weekend Appleverse Recap"
2024-02-04,"After Skyrocketing 615%, Why Does Warren Buffett Still Own Apple Stock?"
2024-02-04,"If You Invested $1000 In Apple When Steve Jobs Returned To Apple 28 Years Ago, Here's How Much You'd Have"
2024-02-04,"Morgan Stanley Recommends Loading Up on AAPL, AMZN, and META After Earnings"
2024-02-05,Where Will Apple Stock Be in 3 Years?
2024-02-05,Apple's Earnings Show Its Steady State Weakness
2024-02-05,Dan Ives: Apple’s (NASDAQ:AAPL) Vision Pro Could Be a ‘Game Changer’
2024-02-06,Is the Vision Pro A Good or Bad Thing for Apple (AAPL) Investors?
2024-02-06,Apple Inc. (NASDAQ:AAPL) Just Released Its First-Quarter Results And Analysts Are Updating Their Estimates
2024-02-06,Analyst Estimates: Here's What Brokers Think Of Apple Inc. (NASDAQ:AAPL) After Its First-Quarter Report
2024-02-07,Where Will Apple Stock Be in 1 Year?
2024-02-07,Apple (NASDAQ:AAPL) Goes Retro with Foldable Phones
2024-02-07,3 Tech Stocks to Keep an Eye on in February
2024-02-08,Apple Stock (NASDAQ:AAPL): 2 Catalysts That Could Power Shares to $250
2024-02-08,"Meta Platforms and Amazon Surged Last Week, Apple Stock Fell. My Top Pick of the 3 to Buy Now."
2024-02-08,"Apple: Hitting The Mark, Time For A Breather (NASDAQ:AAPL)"
2024-02-09,Apple vs Amazon: which is the best 'Magnificent 7' stock to buy today?
2024-02-09,"In the Age of Artificial Intelligence (AI), Is Apple Finished?"
2024-02-09,AAPL Stock Forecast: Surprise! Why Apple Is In Better Shape Than People Realize.
2024-02-10,Apple: Poised To Continue Disrupting Our Lifestyles
2024-02-10,Peter Thiel-backed 'Olympics On Steroids' Considers Allowing Athletes To Use Apple Vision Pro
2024-02-10,Is It Too Late to Buy Apple Stock?
2024-02-11,Why Apple Is No Longer A Great Stock
2024-02-11,Apple's 'Super Bowl Moment?' Analyst Sees $5B Annual Run-rate From This Opportunity That Will Likely Lead To Growth 'Renaissance
2024-02-11,7 Tech Stocks to Buy on the Dip: February 2024
2024-02-12,Huawei's Gain Is Apple's Pain
2024-02-12,Apple (NASDAQ:AAPL) to Settle Chip Theft Lawsuit with Rivos
2024-02-12,Meta's New Strategy Resembles Apple
2024-02-13,Piper Sandler Overweight on Qualcomm shares in light of Apple partnership
2024-02-13,"If You Invested $10,000 in Apple When Tim Cook Became CEO, This Is How Much You'd Have Today"
2024-02-13,Apple's Biggest Threat Isn't What You Think
2024-02-14,"Berkshire trims Apple, sheds four stocks, mum on new investment"
2024-02-14,AAPL Stock Outlook: Pick Up the Phone! $200 Is Calling.
2024-02-14,"Buffett’s Berkshire Trims Stake in AAPL, Adds CVX"
2024-02-15,EXCLUSIVE: Buffett still considers Apple stock a core holding despite stake sale - analyst
2024-02-15,Buffett Dumps Apple Shares
2024-02-15,It's Time for Apple to Raise Its Paltry Dividend
2024-02-16,iPhone's Decline In China Continues In 2024 Despite Apple's Recent Price Cuts: Kuo
2024-02-16,Magnificent 7 Stocks Trigger Concerns Of Market Overheat: Bubble Trouble?
2024-02-16,The Next Apple? 3 Tech Stocks That Investors Shouldn’t Ignore.
2024-02-17,"Apple's Vison Pro Could Send the Stock Up 35%, According to This Wall Street Analyst"
2024-02-17,"A Golden Investment Opportunity: 1 Top Stock to Buy Before It Soars 40% to Hit $4 Trillion, According to a Wall Street Analyst"
2024-02-17,Warren Buffett Sold Nearly $2 Billion Worth of Apple Last Quarter. Here's Why.
2024-02-18,Apple (NASDAQ:AAPL) Faces Potential Fine from the EU
2024-02-18,Apple Still Has A China Problem
2024-02-18,Hold Up! Why It’s Too Early to Take a Bite of Apple Stock Right Now.
2024-02-19,Is Meta’s (NASDAQ:META) Zuckerberg Right About the Apple Vision Pro?
2024-02-19,It’s Time! 3 Overheated Dow Stocks to Sell in February
2024-02-19,Exit Now! 3 Tech Stocks to Sell in February 2024.
2024-02-20,Apple (NASDAQ:AAPL) shareholders have earned a 34% CAGR over the last five years
2024-02-20,"Apple Is Synonymous With iPhones, But Its Largest Gross Margin Comes From Somewhere Else Entirely"
2024-02-20,Should You Worry About Apple's Slowdown in China?
2024-02-21,Apple (NASDAQ:AAPL) Up Fractionally despite Rising Vision Pro Returns
2024-02-21,Apple launches free new sports app for iPhone (NASDAQ:AAPL)
2024-02-21,Apple: Vision Pro Might Be A Long-Term Catalyst
2024-02-22,Better Tech Stock: Microsoft vs. Apple
2024-02-22,Increases to CEO Compensation Might Be Put On Hold For Now at Apple Inc. (NASDAQ:AAPL)
2024-02-22,Here's Why Shareholders May Want To Be Cautious With Increasing Apple Inc.'s (NASDAQ:AAPL) CEO Pay Packet
2024-02-23,Apple (NASDAQ:AAPL) Fires Back on Spotify’s EU Complaint
2024-02-23,How To Buy Apple Stock (AAPL)
2024-02-23,Four Tech Stocks To Consider Amid The New Bull Market
2024-02-24,Apple may position the next iPhone as an 'AI' phone. What could that look like?
2024-02-24,"Happy Birthday, Steve Jobs! If You Invested $1,000 In Apple Stock When The iPhone Was Unveiled, Here's How Much You'd Have Today"
2024-02-24,3 Warren Buffett Stocks to Hold Forever
2024-02-25,"iRing, iGlasses Or Supercharged iPods? Gurman Says Apple Brainstorming Wearables That Could Keep More Users Locked In Its Ecosystem"
2024-02-25,Ken Fisher Portfolio: 5 Biggest Positions
2024-02-25,0
2024-02-26,Apple Stock (NASDAQ: AAPL) Is Hanging By A Thread – $180 Support Must Be Held
2024-02-26,"Horizon Kinetics: Chinese Tech Has Boosted Apple (AAPL), the Second Highest-Weighted Company in the S&P 500"
2024-02-26,Alphabet (NASDAQ:GOOGL) Reveals Microsoft’s Plan to Sell Bing to Apple
2024-02-27,Morgan Stanley says Apple discontinuing its electric car project is 'a positive development'
2024-02-27,Apple (NASDAQ:AAPL) Gives Up Electric Car Plans for AI
2024-02-27,Apple: Uninspiring Growth Outlook
2024-02-28,"1 Unstoppable Stock Set to Join Nvidia, Apple, Microsoft, Amazon, Alphabet, and Meta in the $1 Trillion Club"
2024-02-28,"Apple Customers Remain Loyal To iPhone, Feel Vision Pro Is Too Pricey"
2024-02-28,Apple Car Alert: Apple Abandons EV Plans in Favor of AI
2024-02-29,Apple Stock (NASDAQ:AAPL): Will the Vision Pro Reignite Its Growth?
2024-02-29,0
2024-02-29,0