Date,News Article Title
2023-12-25,Former Microsoft CEO Steve Ballmer is on pace to earn $1 billion in dividends annually from his massive stake in the software company
2023-12-26,Former Microsoft CEO Steve Ballmer To Pocket $1B Annually In Dividends
2023-12-26,The top analyst stock picks for 2024: Early predictions
2023-12-26,"Got $5,000? 3 Tech Stocks to Buy and Hold for the Long Term"
2023-12-27,There Are Only 3 'Magnificent Seven' Stocks I Would Buy in 2024
2023-12-27,"NY Times sues OpenAI, Microsoft for infringing copyrighted works"
2023-12-27,Google and Microsoft: The Emergence of the AI Duopoly
2023-12-28,"Microsoft Stock (NASDAQ:MSFT) Has More Room to Run, According to Analyst"
2023-12-28,Analyst raises Microsoft stock price target to $450 amid ‘iPhone moment’
2023-12-28,NYT vs. OpenAI/Microsoft legal battle: Who wins? Analysts weigh in
2023-12-29,Is It Too Late to Buy Microsoft?
2023-12-29,New York Times Sues OpenAI and Microsoft - AI Copyright Infringement Amid 54% Stock Surge
2023-12-29,Why I Expect to Receive More in Dividends in 2024 Than in 2023
2023-12-30,Data Center Dynamos: 3 Stocks Powering the Information Age
2023-12-30,"IBM: A Beneficiary Of AI In 2024, While All Eyes Are On Microsoft"
2023-12-30,"Want $1 Million in Retirement? Invest $300,000 in These 3 Stocks and Wait a Decade."
2023-12-31,Better Artificial Intelligence (AI) Stock for 2024: Nvidia vs. Microsoft
2023-12-31,Legacy Investments: 7 Stocks to Make Your Grandkids Millionaires
2023-12-31,Ritholtz Wealth Management Raises Holdings in Microsoft Co. (NASDAQ:MSFT)
2024-01-01,Revealed: Nancy Pelosi’s stock portfolio performance in 2023
2024-01-01,Investors in Microsoft (NASDAQ:MSFT) have seen strong returns of 288% over the past five years
2024-01-01,0
2024-01-02,Microsoft: Still Attractively Valued When Factoring In Each Segment
2024-01-02,Why Microsoft (MSFT) Dipped More Than Broader Market Today
2024-01-02,Microsoft: Worth Holding Onto For Long-Term Investors
2024-01-03,Could Microsoft Stock Help You Retire a Millionaire?
2024-01-03,"If You Invested $10,000 in Microsoft When Satya Nadella Became CEO, This Is How Much You Would Have Today"
2024-01-03,A Bull Market Is Coming: 2 Stock-Split Stocks to Buy as Part of Your New Year's Resolution
2024-01-04,Is Microsoft Stock a Buy Now?
2024-01-04,Wall Street sets Microsoft stock price for the next 12 months
2024-01-04,The 7 Hottest Tech Stocks to Watch in 2024
2024-01-05,"With 72% institutional ownership, Microsoft Corporation (NASDAQ:MSFT) is a favorite amongst the big guns"
2024-01-05,Can Microsoft Stock (NASDAQ:MSFT) Stay Magnificent Through 2024?
2024-01-05,Why MSFT Is the One Mega-Cap Tech Stock Every Investor Should Consider Owning
2024-01-06,Microsoft Kicked Off 2024 by Announcing One of Its Biggest Changes in Over 30 Years. Here's What It Means for Investors.
2024-01-06,2 Blue Chip Stocks to Buy Hand Over Fist Before the Nasdaq Surges in 2024
2024-01-06,0
2024-01-07,Microsoft's Windows Faces a New Threat From an Old Enemy
2024-01-07,0
2024-01-07,0
2024-01-08,"Microsoft (NASDAQ:MSFT), OpenAI: Legal Punches Keep Coming"
2024-01-08,2024’s Top Picks: Which 3 Magnificent Seven Stocks Should You Buy?
2024-01-08,Microsoft to offtake 12 GW of Qcells solar panels made in US
2024-01-09,Possible Bearish Signals With Microsoft Insiders Disposing Stock
2024-01-09,Is Microsoft Stock a Buy?
2024-01-09,Microsoft (NASDAQ:MSFT) Gains Slightly Thanks to New Battery
2024-01-10,Can Microsoft (NASDAQ:MSFT) Overtake Apple?
2024-01-10,"Microsoft: 1 Reason To Avoid The Stock, And It Isn't OpenAI"
2024-01-10,IBD Stock of The Day: Microsoft Gearing Up For AI-Powered Growth
2024-01-11,Microsoft (NASDAQ:MSFT) Announces New EU Data Plans
2024-01-11,Dow Jones Futures Await Inflation Data; Microsoft Leads 5 New Buys; Bitcoin Rises On ETF Approvals
2024-01-11,"Microsoft Back On Top, Dethrones Apple As World's Most Valuable Company"
2024-01-12,"With Microsoft's Value at $518 Per Share, Investors Can Short Puts for Extra Income"
2024-01-12,Microsoft passes Apple as most valuable public company
2024-01-12,MSFT Stock Outlook: What’s in Store for Microsoft Investors in 2024?
2024-01-13,Where Will Microsoft Stock Be in 1 Year?
2024-01-13,Better Artificial Intelligence (AI) Stock: Microsoft vs Alphabet
2024-01-13,0
2024-01-14,Why Microsoft Corporation (NASDAQ:MSFT) Could Be Worth Watching
2024-01-14,"With 72% ownership in Microsoft Corporation (NASDAQ:MSFT), institutional investors have a lot riding on the business"
2024-01-14,Better AI Stock: Microsoft vs. Palantir Technologies
2024-01-15,Microsoft Corporation (MSFT)’s Revenue Grew 12% in Q4
2024-01-15,"Vodafone and Microsoft sign 10-year strategic partnership to bring generative AI, digital services and the cloud to more than 300 million businesses and consumers"
2024-01-15,GRAPHIC-Microsoft topples Apple to become global market cap leader
2024-01-16,Microsoft (MSFT): World's Most Valuable Company
2024-01-16,Microsoft (NASDAQ:MSFT) Launches Copilot Pro to Attract More Users
2024-01-16,VOD Stock Alert: Vodafone Signs $1.5 Billion AI Deal With Microsoft
2024-01-17,0
2024-01-17,0
2024-01-17,0
2024-01-18,Better AI stock: Microsoft vs. Amazon
2024-01-18,"Now That Microsoft Is The World’s Most Valuable Company, Has Apple Peaked?"
2024-01-18,"Here are Thursday’s biggest analyst calls: Apple, Netflix, Nvidia, Meta, Rivian, Costco, Hertz, Microsoft and more"
2024-01-19,Is Microsoft Stock a Buy Now?
2024-01-19,"Up 63% Since The Beginning Of 2023, How Will Microsoft Stock Trend After Q2 Earnings?"
2024-01-19,Could Microsoft Stock Help You Retire a Millionaire?
2024-01-20,Microsoft’s Bold AI Bet: Will It Pay Off for MSFT Stockholders?
2024-01-20,Does Microsoft's Latest Artificial Intelligence (AI) Product Make It a Screaming Buy?
2024-01-20,0
2024-01-21,"Up 63% Since The Beginning Of 2023, How Will Microsoft Stock Trend After Q2 Earnings?"
2024-01-21,Here’s Why Microsoft Corporation (MSFT) is in Detractors’ List of Polen Focus Growth
2024-01-21,Microsoft Rises Like A Phoenix From The Ashes
2024-01-22,Microsoft (NASDAQ:MSFT) Slips after Huge “Palworld” Launch
2024-01-22,These stocks could benefit following the Microsoft corporate systems breach
2024-01-22,Follow The Billionaire Trail: Unveiling The Stocks Shared By Bill Gates And Other Tycoons
2024-01-23,Microsoft: Azure Taking Share With AI Push
2024-01-23,"Let Bears Fret About Tech Valuations, Analyst Says: How AI Leaders Microsoft, Nvidia And Google Can Push Higher"
2024-01-23,"AAPL, AMZN, MSFT: How to Play the Tech Giants Ahead of Earnings"
2024-01-24,Microsoft (NASDAQ:MSFT) Hits $3 Trillion Milestone
2024-01-24,Microsoft hits $3 trillion market value
2024-01-24,Microsoft (MSFT) Stock Just Touched a $3 Trillion Market Cap. Who Will Be Next?
2024-01-25,Why We Like The Returns At Microsoft (NASDAQ:MSFT)
2024-01-25,Microsoft (NASDAQ:MSFT) Seems To Use Debt Rather Sparingly
2024-01-25,"Microsoft (NASDAQ:MSFT) Cuts 1,900 Workers at Activision-Blizzard"
2024-01-26,"Microsoft Stock: Buy, Sell, or Hold?"
2024-01-26,Microsoft Q4 Preview: Winning From AI-Led Product Supremacy
2024-01-26,Where Will Microsoft Stock Be in 2025?
2024-01-27,History Suggests the Nasdaq Will Soar in 2024: 2 Brilliant Artificial Intelligence (AI) Growth Stocks to Buy Before It Does
2024-01-27,3 Dividend-Paying Tech Stocks to Buy Right Now
2024-01-27,0
2024-01-28,"Weekly Preview: Earnings To Watch This Week 1-28-24 (AMZN, AAPL, GOOG, META, MSFT)"
2024-01-28,"MSFT, GOOGL: What to Expect from Tech Titans’ Upcoming Earnings"
2024-01-28,"1 Stock to Buy, 1 Stock to Sell This Week: Microsoft, General Motors"
2024-01-29,Investors see Microsoft's stock market value leaving Apple behind
2024-01-29,MSFT Earnings Impact: Buy or Hold Decision?
2024-01-29,"Microsoft Hits an All-Time High, But It's Still Some Way From Becoming the Most Important Stock in the Dow Jones Industrial Average"
2024-01-30,Microsoft (MSFT) Q2 2024 Earnings: What to Expect
2024-01-30,Microsoft Corporation's (NASDAQ:MSFT) Stock's On An Uptrend: Are Strong Financials Guiding The Market?
2024-01-30,Strong Earnings From Microsoft (MSFT) Stock Fail to Impress Wall Street
2024-01-31,Microsoft Is Already the World's Largest Company. Here's Why That's Unlikely to Change Anytime Soon. (Hint: It's Not Just Artificial Intelligence (AI))
2024-01-31,"Yes, Microsoft Is a Star AI Stock, But This Is What Really Powered Its Solid Second-Quarter Results"
2024-01-31,"Wedbush's Dan Ives Lauds Microsoft's 'Masterpiece Quarter,' Says CEO Nadella's Guidance 'Should Be Hung In The Louvre'"
2024-02-01,Microsoft Corporation (NASDAQ:MSFT) Q2 2024 Earnings Call Transcript
2024-02-01,"This New ETF Allows Investment In Apple, Microsoft And Other 'Magnificent 7' Stocks"
2024-02-01,"Midday movers: Boeing flies, Alphabet flops, and more"
2024-02-02,"When You Look Back in 5 Years, You'll Wish You'd Bought This Trillion-Dollar Artificial Intelligence (AI) Stock"
2024-02-02,Microsoft Is Embracing an AI Revolution
2024-02-02,The 3 Best Dow Jones Stocks to Invest In for Big Gains in 2024
2024-02-03,Amazon's AWS Vs. Microsoft's Azure Vs. Google Cloud: Which Company Won The Cloud Race In Q4?
2024-02-03,2 Stocks I'll Be Adding to My Retirement Account -- Even With the S&P 500 at an All-Time High
2024-02-03,0
2024-02-04,Follow The Billionaire Trail: Unveiling The Stocks Shared By Bill Gates And Other Tycoons
2024-02-04,5 big analyst AI moves: Bullish on Microsoft and Google; AMD cut
2024-02-04,Microsoft vs. Google: Which Is the Better AI Stock to Buy Now
2024-02-05,"Up Nearly 70% Since The Beginning Of 2023, Where Is Microsoft Stock Headed?"
2024-02-05,Is Microsoft Stock a Buy?
2024-02-05,Riding the AI Wave: Is Microsoft Unstoppable in 2024?
2024-02-06,"Up Nearly 70% Since The Beginning Of 2023, Where Is Microsoft Stock Headed?"
2024-02-06,How To Earn $500 Per Month From Microsoft Stock
2024-02-06,"If You Invested $5,000 in Microsoft Stock in 2014, This Is How Much You'd Have Today"
2024-02-07,Microsoft Stock (NASDAQ:MSFT): The Long-Term Bull Case Has Been Reaffirmed
2024-02-07,Time to Buy Microsoft's (MSFT) Stock for More Upside
2024-02-07,Recurrent attracts Microsoft as off-taker for Louisiana solar project
2024-02-08,"With EPS Growth And More, Microsoft (NASDAQ:MSFT) Makes An Interesting Case"
2024-02-08,"This ""Magnificent Seven"" Stock Proved Once Again Why It's the Surest of Them All"
2024-02-08,Microsoft partners with India's Sarvam AI for voice-based genAI tools
2024-02-09,Microsoft (NASDAQ:MSFT) Backed OpenAI Hits $2B in Revenue
2024-02-09,Have Insiders Sold Microsoft Shares Recently?
2024-02-09,7 Tech Stocks Primed for a Red-Hot 2024
2024-02-10,Where Will Microsoft Stock Be in 3 Years?
2024-02-10,"Microsoft ends week with $3.125 tn MCap, becomes most valuable company ever"
2024-02-10,New to Investing? 2 Easy Stocks to Start Building Wealth Today
2024-02-11,The Microsoft Money Machine: Why AI Will Help MSFT Stock Outperform in 2024
2024-02-11,"Puzzling,' Says Analyst As Microsoft's Valuation Double That Of Energy Companies Despite Generating Half Their Cash Flow"
2024-02-11,"If You Invested $1,000 in Microsoft When It First Declared a Dividend, This Is How Much You'd Have Now"
2024-02-12,Earnings Growth & Price Strength Make Microsoft (MSFT) a Stock to Watch
2024-02-12,Microsoft’s (NASDAQ:MSFT) Future in Video Games Gets a Reveal Date
2024-02-12,Options Traders Target Microsoft Stock Amid Record Highs
2024-02-13,Microsoft: The Upside Scenario Is Supported By AI
2024-02-13,MSFT Stock Outlook: Time to Take Profit? Not So Fast!
2024-02-13,5 Best Autonomous Driving Stocks To Buy Now
2024-02-14,The Next Microsoft? 3 Future Trillion-Dollar Stocks That Investors Shouldn’t Ignore
2024-02-14,Home Run Alert: Why Microsoft Stock Is Your MVP Pick for 2024!
2024-02-14,0
2024-02-15,Microsoft’s (NASDAQ:MSFT) Business Update Presents Uncertain Future for Xbox
2024-02-15,Microsoft: Not Worth Your Money At Today's Price
2024-02-15,Microsoft to invest 3.2 bln eur in Germany in AI push
2024-02-16,What Is Microsoft Corporation's (NASDAQ:MSFT) Share Price Doing?
2024-02-16,Microsoft (NASDAQ:MSFT) Loses Ground as Activision Gets Sued
2024-02-16,Better Artificial Intelligence (AI) Buy: Microsoft vs. Alphabet
2024-02-17,Microsoft: Is The Thrill Of Victory Worth The Agony Of Defeat?
2024-02-17,Will IBM Be a Trillion-Dollar Stock by 2030?
2024-02-17,0
2024-02-18,Stock-Split Watch: Is Microsoft Next?
2024-02-18,The 3 Best Tech Stocks to Buy in February 2024
2024-02-18,0
2024-02-19,Microsoft-Backed (NASDAQ:MSFT) OpenAI Hits $80B Valuation
2024-02-19,The Art of Valuation: Discovering Microsoft Corp's Intrinsic Value
2024-02-19,Microsoft’s AI Leap: How a $3.5 Billion Investment Could Skyrocket MSFT Stock
2024-02-20,Is Microsoft Corporation's (NASDAQ:MSFT) Latest Stock Performance Being Led By Its Strong Fundamentals?
2024-02-20,3 Stocks to Buy to Cash In on the Next Big Thing
2024-02-20,How Microsoft's Artificial Intelligence (AI) Rebranding Expands Its Market Potential
2024-02-21,Microsoft Stock 2024 Outlook - 3 Strong Catalysts For Growth
2024-02-21,"Insiders At Microsoft Sold US$76m In Stock, Alluding To Potential Weakness"
2024-02-21,5 Best Stocks To Buy Before Recessions
2024-02-22,Reasons to Invest in Microsoft Corporation (MSFT)
2024-02-22,Reasons to Invest in Microsoft Corporation (MSFT)
2024-02-22,Better Tech Stock: Microsoft vs. Apple
2024-02-23,Don’t Wait Another Second! Buy Microsoft Stock Now.
2024-02-23,0
2024-02-23,0
2024-02-24,Will Nvidia Be Worth More Than Microsoft by 2025?
2024-02-24,Will Super Micro Computer Be Worth More Than Microsoft by 2050?
2024-02-24,Microsoft Will Be One Of The Biggest Beneficiaries Of Artificial Intelligence
2024-02-25,Is It Too Late to Buy Microsoft Stock?
2024-02-25,Ken Fisher Portfolio: 5 Biggest Positions
2024-02-25,Jim Cramer Says Do Not Buy These 11 Stocks
2024-02-26,MSFT Stock Analysis: Microsoft’s Premium Valuation Is More Than Justified
2024-02-26,Microsoft (NASDAQ:MSFT) Invests in French AI Startup
2024-02-26,Here’s Why Microsoft Corporation (MSFT) Rose in Q4
2024-02-27,Assessing Microsoft (MSFT) Stock Near All Time Highs
2024-02-27,Microsoft: Copilot Could Boost Annual Revenue By 12%
2024-02-27,Wall Street sets Microsoft stock price for the next 12 months
2024-02-28,Microsoft ad investments spark $50B opportunity: Barclays
2024-02-28,Microsoft (MSFT) Ascends While Market Falls: Some Facts to Note
2024-02-28,Microsoft's Sydney AI Makes A Comeback? New Copilot Conversations Hint At The Return Of The Sassy Chatbot
2024-02-29,Returns On Capital Are A Standout For Microsoft (NASDAQ:MSFT)
2024-02-29,Microsoft (NASDAQ:MSFT) Readies a New Copilot for Financial Workers
2024-02-29,5 Best Stocks to Buy According to Billionaire D.E. Shaw