Date,News Article Title
2023-09-01,AES Brasil signs 154-MW wind PPA with Microsoft
2023-09-01,Dow Jones Rallies 250 Points On Unemployment Rate Jump; Tesla Stock Skids After New Model 3 Release
2023-09-01,Top 25 Stocks in the S&P 500 by Index Weight for September 2023
2023-09-02,Here's why stocks may surprise to the upside in September
2023-09-02,Jim Cramer Recommended These 10 Stocks
2023-09-02,0
2023-09-03,Motley Fool: Microsoft a giant that’s only getting bigger
2023-09-03,"Meta's AI Privacy, Microsoft's Smart Backpack And Google's Fight Against Fake News: This Week In AI"
2023-09-03,Bill Gates Almost Killed Xbox Because Of This One Reason: 'This Is An Insult To Everything I've Done'
2023-09-04,3 Top Tech Stocks to Buy in September
2023-09-04,3 Very Oversold Tech Stocks to Buy Right Now
2023-09-04,"Buy, Sell or Hold? My Calls on the ‘Magnificent 7’ Stocks"
2023-09-05,"MSFT, PATH, or NVDA: Which AI Stock is the Most Promising Pick?"
2023-09-05,CrowdStrike CEO: 'Microsoft is always going to be a competitor'
2023-09-05,Dow Jones Falls Under Key Level As Oil Stocks Pop; 3 Warren Buffett Stocks Near Entries
2023-09-06,7 Retirement Stocks That Every Long-Term Investor Should Own Now
2023-09-06,"Major Indexes Break 50-Day Line Of Support; Apple, Microsoft Fall As AI Stock Earnings Loom, AMC Crashes"
2023-09-06,Exclusive-AI chip startup d-Matrix raises $110 million with backing from Microsoft
2023-09-07,"If You Invested $1,000 In Microsoft Stock When Bill Gates Left As CEO, Here's How Much You'd Have Today"
2023-09-07,Microsoft Launches New Employee Rating System For Performance Reviews
2023-09-07,5 Reasons to Buy Microsoft Stock Right Now
2023-09-08,"Dow Jones Rises 100 Points, Led By Apple, Microsoft; Adobe Stock Fades Despite Bullish Analyst Note"
2023-09-08,Dow Ekes Out Gain; Microsoft Retakes Key Level As First Solar Rises On Analyst Views
2023-09-08,0
2023-09-09,OpenAI lawsuit alleges data scraping in training AI models
2023-09-09,Google’s Defense in Landmark Antitrust Case Hinges on Lawyers Who Took on Microsoft
2023-09-09,"Google CEO Sundar Pichai Says AI Could Be ""Bigger Than the Internet"": 3 Stocks to Buy and Hold If He's Right"
2023-09-10,Why We Like The Returns At Microsoft (NASDAQ:MSFT)
2023-09-10,2 Artificial Intelligence (AI) Stocks to Buy in September 2023 That Could Soar Like Nvidia
2023-09-10,New/Old Reasons Not To Buy Stocks - Markets
2023-09-11,The 7 Best Tech Stocks to Buy to Capitalize on the AI Revolution
2023-09-11,Top 20 AI and Robotics Companies Transforming the Agriculture Sector
2023-09-11,0
2023-09-12,Citi predicts positive growth for Microsoft after rough August
2023-09-12,2 Top Tech Stocks to Buy During a Recession
2023-09-12,"Magnificent Seven' Dominate S&P 500, But Haunting Echoes Of Dot-Com Bubble Resurface"
2023-09-13,Microsoft Stock Outlook: The Catalysts That Could Send MSFT Surging in 2024
2023-09-13,Better Growth Stock: Apple vs. Microsoft
2023-09-13,"Microsoft Continues Pursuing Activision, Lands Another Green Light"
2023-09-14,Buying on the Dip: 3 Stocks to Snag Now for Supercharged Gains
2023-09-14,Better Buy: Amazon Stock vs. Microsoft Stock
2023-09-14,The Fortune 500 Companies Earning The Most (And Least) Profit Per Worker
2023-09-15,Microsoft has analysts 'increasingly bullish' on AI tool Copilot's revenue uplift potential
2023-09-15,"Lauren Knausenberger Appointed SAIC EVP, Chief Innovation Officer"
2023-09-15,Alibaba Makes A Big AI Leap As Technology Continues To Evolve From Being A Useful Tool To A Genuine Game Changer
2023-09-16,Is Microsoft Stock a Buy Now?
2023-09-16,"‘Load Up,’ Says Goldman Sachs About Microsoft Stock"
2023-09-16,"US, Vietnam strengthen bilateral ties in AI and aviation"
2023-09-17,Microsoft Stock Is Still Cheap Given Its Massive Free Cash Flow
2023-09-17,"When You Look Back in a Few Years, You Might Wish You'd Bought This Trillion-Dollar AI Stock"
2023-09-17,0
2023-09-18,Departing Microsoft hardware boss Panos Panay said to be heading to Amazon
2023-09-18,"Microsoft Product Chief Is Exiting, in Blow to Hardware Unit"
2023-09-18,Missed Out on NVDA and META? 3 More AI Stocks to Buy Before It’s Too Late
2023-09-19,Microsoft Eyes Apple’s Spot as World’s Largest Stock
2023-09-19,Microsoft Is Gradually Closing In on Apple as It Eyes Position as World’s Largest Stock
2023-09-19,"Microsoft's Vision For Xbox: Next-Gen Consoles By 2028, Mid-Gen Refresh In 2024"
2023-09-20,"Microsoft: Don't Knock The Dividend Yield, Look At Growth And Longevity Instead"
2023-09-20,0
2023-09-20,0
2023-09-21,Microsoft Is a Great Dividend Stock and Just Boosted Its Payout
2023-09-21,"Microsoft Stock: AI Monetization About to Takeoff, Says Top Analyst"
2023-09-21,Microsoft lifts quarterly dividend by 10% amid strong business performance
2023-09-22,The Future Of Cancer Detection: Microsoft And Paige's AI Behemoth
2023-09-22,"Here's How Nvidia, Apple, and Microsoft Could Pay You $1,000 Per Year in Dividend Income"
2023-09-22,"US Stocks Rise As Tech Rebounds On Lower Treasury Yields, UAW Strikes Widen: What's Driving Markets Friday?"
2023-09-23,Should You Hold or Fold Amid Microsoft's Bid for Activision Blizzard?
2023-09-23,"Have $1,000? 2 Growth Stocks to Buy Now and Hold Forever."
2023-09-23,"With History and AI on Their Side, Tech Stocks Could be Unfazed by Higher Rates"
2023-09-24,UK competition authority provisionally approves Microsoft's acquisition of Activision Blizzard
2023-09-24,Is the AI Bubble Already Popping?
2023-09-24,0
2023-09-25,Microsoft (NASDAQ: MSFT) Receives Surprise Upgrade from Analyst
2023-09-25,Here’s how much a $10k investment in Microsoft stock in 2010 is now worth
2023-09-25,Microsoft Could Be Making a Big Change and AI Investors Aren't Going To Like It
2023-09-26,Microsoft: 5 Reasons Why The Stock Is A Strong Buy
2023-09-26,Stocks Today: Nasdaq Falls Hard As JPMorgan Chief Sees Rates Rising; Will Microsoft Stock Form This Bullish Pattern?
2023-09-26,Microsoft Copilot: Unifying AI for Windows 11 and Microsoft 365 users
2023-09-27,Better Artificial Intelligence (AI) Stock: Microsoft vs. Alphabet
2023-09-27,Elon Musk Needs To Short This': OpenAI's Lofty $90B Valuation Aim Sparks Flood Of Hilarious Replies On X
2023-09-27,FTC to revive fight against Microsoft's acquisition of Activision Blizzard
2023-09-28,Microsoft (NASDAQ:MSFT) Is Increasing Its Dividend To $0.75
2023-09-28,Microsoft (NASDAQ:MSFT) Is Increasing Its Dividend To $0.75
2023-09-28,Better Buy: Microsoft vs. Nvidia
2023-09-29,Is It Too Late to Buy Microsoft Stock?
2023-09-29,Microsoft Boosts Its Dividend Again. Here's How High the Payout Could Get Over the Next 20 Years
2023-09-29,"The Silicon Valley Wage War: Unveiling Salaries Of Top Talent At Apple, Microsoft, Google"
2023-09-30,Top 20 Cloud Computing Companies in USA
2023-09-30,7 S&P 500 Stocks Set to Explode Higher
2023-09-30,0
2023-10-01,"The Best Stocks to Buy With $10,000 Right Now"
2023-10-01,How To Turn Off Windows Copilot So It’s Not Snooping Your Windows 11
2023-10-01,3 Robinhood Stocks to Buy and Hold Forever
2023-10-02,Microsoft Insiders Sold US$49m Of Shares Suggesting Hesitancy
2023-10-02,Microsoft's Satya Nadella To Take The Stand Today At Google Antitrust Trial: What You Need To Know
2023-10-02,Microsoft CEO warns of ‘nightmare’ future for AI if Google’s search dominance continues
2023-10-03,Where Will Microsoft Stock Be in 3 Years?
2023-10-03,"NVDA, ADBE, MSFT: 3 Companies Aiming to Make AI Safe"
2023-10-03,"High-Flier Nvidia Could Rally Another 70% On 'Extremely Strong' AI Data Center Demand, Says Analyst"
2023-10-04,Microsoft’s Bing Chat Enhances Image Generation With OpenAI’s Dall-E 3 Model
2023-10-04,0
2023-10-04,0
2023-10-05,Microsoft’s (NASDAQ:MSFT) New Military Goggles Receive Positive Feedback
2023-10-05,US and UK Regulators Are Going After Amazon And Microsoft
2023-10-05,"Are We Living In A Multiverse Or A Simulation? Depends On Who You Ask, Says Peter Thiel"
2023-10-06,"Microsoft Stock, Analysts Predict Double-Digit Upside"
2023-10-06,Microsoft (NASDAQ:MSFT) Set to Close Activision Deal Next Week
2023-10-06,The AI Revolution: How Microsoft Is Positioning Itself for the Future
2023-10-07,Cramer Says 'Will Not Sell' Nvidia Stock On 'Misinformation' About Microsoft AI Chip
2023-10-07,"AVGO, NVDA, or INTC: Which Chip Stock is the Best Pick?"
2023-10-07,0
2023-10-08,"Peter Thiel's Multiverse Theory, Tom Hanks' AI Warning, Microsoft's Bing AI Image Creator Controversy And More: This Week In AI"
2023-10-08,Q4 Stock Predictions: 3 Nasdaq Stocks Ready to Roar Into 2024
2023-10-08,Inaugural Cohort of the Nigeria Jubilee Fellows Programme joins Microsoft ADC West Africa in a Quest to Empower Nigerian Youth
2023-10-09,Microsoft: 'The' Big 5 Tech Company
2023-10-09,"Microsoft, Google, And Adobe Navigate AI's Profitability Challenge"
2023-10-09,"This Investment Manager Just Sold Nvidia Stock, Says Microsoft Will Be The 'Number One Beneficiary Of AI'"
2023-10-10,Should Nvidia Stock Investors Be Worried About Microsoft Potentially Creating an AI Chip?
2023-10-10,Analysts: Microsoft (NASDAQ:MSFT) is Top Dog in AI
2023-10-10,Microsoft (NASDAQ:MSFT) Is Very Good At Capital Allocation
2023-10-11,Microsoft (NASDAQ:MSFT) Opposes $29B Demand from IRS
2023-10-11,Activision-Blizzard Deal Racing to Friday the 13th Finish Line
2023-10-11,Microsoft's Health Tech Push Opens New Investment Avenues
2023-10-12,MSFT Stock Price Prediction: What Can Investors Expect in 2024?
2023-10-12,Is It Too Late to Buy Microsoft Stock?
2023-10-12,MSFT Stock Alert: The $29 Billion Reason Microsoft Is Down Today
2023-10-13,Is Microsoft a Buy?
2023-10-13,ChatGPT predicts Microsoft stock price after it buys Activision
2023-10-13,Satya Nadella Just Proved That MSFT Stock Is a Losing Bet
2023-10-14,Is Microsoft Stock a Buy Now?
2023-10-14,0
2023-10-14,0
2023-10-15,"Is Microsoft, At The Right Price, The Best AI Stock?"
2023-10-15,Buffett’s Successors: 3 Stocks the Next Generation of Billionaires Are Buying
2023-10-15,0
2023-10-16,Microsoft's Secret Weapons in the Artificial Intelligence Race
2023-10-16,"Minecraft Celebrates 15 Years, Hits A Monumental Benchmark: What's The Magic Number?"
2023-10-16,Better Artificial Intelligence (AI) Stock: Apple vs. Microsoft
2023-10-17,Morgan Stanley Says Microsoft (NASDAQ:MSFT) is Underpriced
2023-10-17,What’s Next for MSFT Investors Now That the Microsoft-Activision Deal Is Done?
2023-10-17,2 Green Flags for Microsoft's Future
2023-10-18,Microsoft Corporation (NASDAQ:MSFT) is favoured by institutional owners who hold 72% of the company
2023-10-18,Microsoft CEO Satya Nadella Says This Is 'The Hardest Skill We Learn' — It's Not Technical
2023-10-18,"Microsoft Salaries, Bonuses, Stock Awards Show Up In Leaked Documents"
2023-10-19,Is Microsoft Stock a Buy Going into Earnings?
2023-10-19,"Microsoft: ChatGPT Bet, Azure Revenues in Focus Ahead of Key Earnings Report"
2023-10-19,Big Tech Stocks: Q3 Earnings Preview
2023-10-20,"Microsoft Earnings Report To Focus On Cloud Computing, Generative AI"
2023-10-20,Microsoft Earnings Preview: AI and Activision's Impact?
2023-10-20,Microsoft is now a gaming juggernaut
2023-10-21,Is It Time to Bet on Small Caps? Analysts Share Insights On The Valuation Gap Versus Large Caps
2023-10-21,0
2023-10-21,0
2023-10-22,Is It Time To Consider Buying Microsoft Corporation (NASDAQ:MSFT)?
2023-10-22,"‘Stay Patient,’ Says Morgan Stanley About Microsoft Stock"
2023-10-22,"Earnings week ahead: Amazon, Microsoft, Alphabet, Meta, Ford, GM and more"
2023-10-23,Microsoft's Stock Is About to Get Cheaper Thanks to the Activision Blizzard Deal. Should You Buy?
2023-10-23,Nasdaq 100 forecast: How will Microsoft Q1 earnings impact MSFT stock?
2023-10-23,Microsoft (NASDAQ:MSFT) Advances as Non-Cloud Assets Prove Their Worth
2023-10-24,Microsoft (MSFT) Q1 2024 Earnings: What to Expect
2023-10-24,Microsoft (NASDAQ:MSFT) Jumps after Impressive Q1 Results
2023-10-24,Microsoft Trounces September-Quarter Goals On Cloud Computing Strength
2023-10-25,"What Investors Should Take Away from Microsoft, Alphabet Earnings"
2023-10-25,Microsoft (NASDAQ:MSFT) vs. Google: Who Has the Upper Hand in Cloud Space?
2023-10-25,"Dow Jones Futures: Microsoft, Google Are Big Earnings Movers After S&P 500 Regains Key Level"
2023-10-26,Microsoft: Take Your Profits Before They Disappear (Rating Downgrade)
2023-10-26,Is Microsoft Corporation's (NASDAQ:MSFT) Latest Stock Performance A Reflection Of Its Financial Health?
2023-10-26,Rockwell Automation and Microsoft Expand Partnership to Leverage Generative AI Capabilities for Enhanced Productivity and Faster Time-to-Market
2023-10-27,Why Microsoft Stock (NASDAQ:MSFT) Can Lead the “Magnificent Seven” Higher
2023-10-27,Microsoft Earnings Review: Bing Is Changing The Game
2023-10-27,Where Will Microsoft Stock Be in 3 Years?
2023-10-28,Microsoft Leads These 5 Dow Jones Stocks Near Buy Points
2023-10-28,7 Blue-Chip Stocks to Buy on Every Single Dip
2023-10-28,Microsoft Stock: Bear vs. Bull
2023-10-29,3 Stock-Split Stocks Due for Another Split
2023-10-29,Amazon's AWS Vs. Microsoft Azure Vs. Google Cloud: How The Cloud Race Stacked Up In Q3
2023-10-29,"Microsoft Is Crushing Google in a Massive Market, and AI Is a Big Reason Why"
2023-10-30,Microsoft: Could A Stock Split Be Coming Soon?
2023-10-30,Why Microsoft Stock Was Climbing the Charts Today
2023-10-30,Microsoft's 'iPhone Moment' With M365 Copilot: Analysts Predict $10B+ AI Revenue Surge By 2025
2023-10-31,Is Microsoft About to Overtake Apple as the World's Most Valuable Company?
2023-10-31,Microsoft (MSFT) thrives on cloud and AI prowess. Is the stock a buy?
2023-10-31,3 Stocks to Watch for Breakthrough Innovations in 2024
2023-11-01,Microsoft’s (NASDAQ:MSFT) LinkedIn Passes 1 Billion Users Mark
2023-11-01,Catch the AI Boom: 3 Stocks to Watch Now
2023-11-01,Microsoft: Could A Stock Split Be Coming Soon?
2023-11-02,Microsoft’s Earnings Victory: Time to Buy MSFT Stock Now?
2023-11-02,"Tim Cook-led Apple Halts Muslim, Jewish Slack Channels After Deleting Israel-Hamas Conflict Posts: Report"
2023-11-02,Has Microsoft Proved It's a Better Growth Stock Than Alphabet?
2023-11-03,Microsoft Stock Is Up 45% YTD And Outperformed The Consensus In Q1
2023-11-03,Here's Why We Think Microsoft (NASDAQ:MSFT) Is Well Worth Watching
2023-11-03,Why Holding Microsoft Stock Could Be A Smart Move
2023-11-04,"‘Load Up,’ Says Top Analyst About Microsoft Stock as AI Opportunity Shifts Focus Back to Growth"
2023-11-04,"Is Microsoft, Amazon, or Alphabet the Best Stock in This $1.5 Trillion Industry?"
2023-11-04,0
2023-11-05,Microsoft Is Too Expensive Here - Wait For A Pullback
2023-11-05,Microsoft: Year-to-date Inflows Send Shares Surging
2023-11-05,Groking Will Become Like Googling' – Elon Musk's High Ambitions For xAI's First AI Product Involves Making It A Verb
2023-11-06,Is it Still Worthy to Keep Your Microsoft (MSFT) Shares?
2023-11-06,Bull Signal Could Boost Big Tech Giant to New Highs
2023-11-06,3 Stocks that ChatGPT Says Will Be Winners This Holiday Season
2023-11-07,"Microsoft’s (NASDAQ:MSFT) Bet on GPT-4 Could Pay-Off, Says Analyst"
2023-11-07,Is Microsoft an Unstoppable Artificial Intelligence (AI) Stock?
2023-11-07,Baron Funds: “Microsoft (MSFT) is Well Positioned to Leverage AI Over the Medium to Long Term”
2023-11-08,"Microsoft Insiders Sell US$49m Of Stock, Possibly Signalling Caution"
2023-11-08,Microsoft (NASDAQ:MSFT) Backed ChatGPT Recovers from Outage
2023-11-08,Microsoft (MSFT) Shares Soar to Record High amid OpenAI-Related Optimism
2023-11-09,Microsoft Record Leads $1.5 Trillion Nasdaq Surge
2023-11-09,Here's Why 'Magnificent Seven' Stock Microsoft Is A Market Leader
2023-11-09,Ready to Bet on Next-Gen AI? Why MSFT Stock Deserves a Spot on Your Watch List.
2023-11-10,Microsoft: Bull Case Is Getting Stronger
2023-11-10,Microsoft Stock Notches Record High Ahead Of AI News
2023-11-10,Prediction: Microsoft Will Overtake Apple as the World's Largest Company By 2025
2023-11-11,7 Must-Buy Stocks to Start Your 2024 Out Strong
2023-11-11,Is A Reconciliation Between Elon Musk And Larry Page On The Horizon? Tesla CEO Open To Rekindling Friendship With Google Co-founder
2023-11-11,"Warren Buffett Refuses to Buy This 'Magnificent Seven' Stock, but It's the Best Dividend Payer of the Bunch"
2023-11-12,"Nasdaq 100 Rally: Microsoft Leads, Tesla Lags"
2023-11-12,0
2023-11-12,0
2023-11-13,Should You Finally Consider Increasing Your Microsoft (MSFT) Shares?
2023-11-13,"After Crushing it in 2023, MSFT Stock isn’t Slowing Down"
2023-11-13,"OpenAI To Develop Superintelligent GPT-5, Seeks More Money From Microsoft"
2023-11-14,Microsoft (NASDAQ:MSFT) shareholders have earned a 31% CAGR over the last five years
2023-11-14,Wall Street sets Microsoft stock price for the next 12 months
2023-11-14,Microsoft strikes deal with Photonic for quantum networking solutions
2023-11-15,Assessing Microsoft (MSFT) Stock at All-Time Highs
2023-11-15,Microsoft Stock (NASDAQ:MSFT): Its Valuation Just Doesn’t Make Sense
2023-11-15,Microsoft (NASDAQ:MSFT) Takes Aim at Nvidia with New Chip
2023-11-16,Microsoft Stock (NASDAQ:MSFT): Its Valuation Just Doesn’t Make Sense
2023-11-16,Microsoft (NASDAQ:MSFT) Is Achieving High Returns On Its Capital
2023-11-16,Microsoft Stock (NASDAQ:MSFT): Still a “Strong Buy” at All-Time High
2023-11-17,Market Rally Extends Gains On Slowing Inflation: Weekly Review
2023-11-17,"The Best Stocks to Invest $50,000 in Right Now"
2023-11-17,0
2023-11-18,3 Top Tech Stocks to Buy Right Now
2023-11-18,2023 Winners: 7 Stocks That Will Continue to Dominate in 2024
2023-11-18,Bill Gates Portfolio: November 2023 Update
2023-11-19,‘A Complete Shocker’: Daniel Ives Weighs in on the Impact of OpenAI CEO’s Departure on Microsoft Stock
2023-11-19,Will The OpenAI Shake-Up Derail Microsoft's Artificial Intelligence Momentum?
2023-11-19,Stock Market Today: Dow racks up gains to close higher on tech strength
2023-11-20,Microsoft (NASDAQ:MSFT) Stock Hits 52-Week High. Is More Upside Ahead?
2023-11-20,Nasdaq leads Wall Street gains as Microsoft hits record
2023-11-20,Microsoft (MSFT) Stock Just Hit a New All-Time High
2023-11-21,Microsoft's Brilliance Is Once Again On Display
2023-11-21,Microsoft's $10 Billion Bet on OpenAI Is Now Up in the Air. Here's Why That's Great News for the Stock.
2023-11-21,Microsoft reaping the benefits of Altman hire
2023-11-22,MSFT vs. PLTR: Which Stock is the Better Buy?
2023-11-22,Microsoft (NASDAQ:MSFT) Gains as Wedbush Sees “Cinderella Ending” Ahead
2023-11-22,Is Microsoft Stock a Buy?
2023-11-23,Is it too late to buy Microsoft stock?
2023-11-23,"Microsoft’s Stock Hits All-Time High, Surpassing $377 Per Share"
2023-11-23,Why Microsoft is the big winner from Sam Altman kerfuffle
2023-11-24,"Investors are clamoring for OpenAI, Microsoft stock amid Sam Altman drama"
2023-11-24,"MSFT, META, GOOGL: 3 Tech Stocks With Dozens of Buy Ratings"
2023-11-24,"The Zacks Analyst Blog Highlights Intel, The Procter & Gamble, 3M, salesforce.com and Microsoft"
2023-11-25,2 Unstoppable Artificial Intelligence (AI) Growth Stocks Billionaires Keep Buying Hand Over Fist
2023-11-25,"Elon Musk's X Could Lose $75 Million In Ad Revenue Over His Support For Antisemitic Post, Says Report"
2023-11-25,0
2023-11-26,3 Best Nasdaq Stocks to Buy in November
2023-11-26,0
2023-11-26,0
2023-11-27,Is It Time To Consider Buying Microsoft Corporation (NASDAQ:MSFT)?
2023-11-27,What Is Microsoft Corporation's (NASDAQ:MSFT) Share Price Doing?
2023-11-27,Microsoft Stock (NASDAQ:MSFT): Analysts Remain Bullish As OpenAI Turmoil Settles
2023-11-28,"Could Microsoft Become the Most Important Stock in the Nasdaq, S&P 500, and Dow?"
2023-11-28,Why Microsoft Stock Is Cheaper Than It Looks
2023-11-28,How To Make $500 A Month With Microsoft As The Stock Hits An All-Time High
2023-11-29,"Microsoft (NASDAQ:MSFT): A ""Momo"" Stock with AI Tailwinds at Its Back"
2023-11-29,Microsoft (MSFT) Suffers a Larger Drop Than the General Market: Key Insights
2023-11-29,Can Microsoft Challenge Amazon’s Cloud Market Dominance?
2023-11-30,Can Microsoft Stock Reach $475? Top Analyst Weighs In
2023-11-30,Microsoft President Makes Startling Revelations on Arrival of Advanced AI
2023-11-30,"If You Can Only Buy One Machine Learning Stock in December, It Better Be One of These 7 Names"
2023-12-01,Alphabet (NASDAQ:GOOGL) Urges Regulators to Curb Microsoft’s Unfair Practices
2023-12-01,Microsoft Stock Got an AI Boost. It’s Far From Over.
2023-12-01,2 Tech Dividend Stocks to Buy and Hold Forever
2023-12-02,"A Bull Market Is Coming: 2 ""Magnificent Seven"" Stocks to Buy Right Now and Hold Forever"
2023-12-02,Forget Microsoft: These Are the Unstoppable Stocks to Buy Now
2023-12-02,0
2023-12-03,3 Big Reasons Why Microsoft May Not Be A Buy After All
2023-12-03,14 Best Most Active Stocks to Buy Now
2023-12-03,2 Artificial Intelligence (AI) Stocks That Are Long-Term Buys
2023-12-04,Bulletproof Investments: 3 Stocks That Will Be Unfazed by Any Market Turmoil
2023-12-04,Google Bard picks 5 stocks to buy in 2024
2023-12-04,Beyond Market Price: Uncovering Microsoft Corp's Intrinsic Value
2023-12-05,Microsoft (MSFT) Increases Despite Market Slip: Here's What You Need to Know
2023-12-05,Will Microsoft Overtake Apple as the World's Largest Company in 2024?
2023-12-05,"MSFT, PLTR, or NVDA: Which is the Most Attractive AI Stock?"
2023-12-06,Why Microsoft Stock Is Still a ‘Buy’ at Current Levels: Argus
2023-12-06,MSFT’s Identity Crisis: Stuck as an ‘Old Man’s Stock’ or Poised for a Tech Rebirth?
2023-12-06,Why Microsoft Stock IS Your Passport to AI Market Wealth
2023-12-07,"Microsoft (NASDAQ: MSFT) Vs. Meta (NASDAQ: META) — Analyzing $1,000 Investments From May 18, 2012"
2023-12-07,Here’s Why You Should Keep an Eye on Your Microsoft (MSFT) Investment
2023-12-07,Microsoft in High-Level Talks with China: A New Era for AI and Trade Cooperation on the Horizon?
2023-12-08,Shareholders Would Enjoy A Repeat Of Microsoft's (NASDAQ:MSFT) Recent Growth In Returns
2023-12-08,Why Apple and Microsoft are the only 2 companies that matter anymore
2023-12-08,Is Microsoft Stock a Buy?
2023-12-09,Is Microsoft (MSFT) Still a Great Investment Choice?
2023-12-09,0
2023-12-09,0
2023-12-10,"ChatGPT's Water Thirst Sparks Grave Concerns, Investment Opportunity In ETF"
2023-12-10,10 Most Popular Technology Stocks Among Billionaires
2023-12-10,Nuvei Stock Is on Fire This Year: Is it a Good Buy Today?
2023-12-11,Double Down on Microsoft Stock Despite Regulatory Fears
2023-12-11,Microsoft (MSFT) Stock Dips While Market Gains: Key Facts
2023-12-11,Microsoft enters into ‘AI alliance’ with labor unions
2023-12-12,Microsoft (NASDAQ:MSFT) Spills the Tea on Phi-2 AI Model
2023-12-12,"Cathie Wood Loads Up On $9M Worth Of Microsoft, Meta And An Evergreen Chip Stock: Time To Dip Into Tech Shares?"
2023-12-12,Apple Went Public 43 Years Ago Today: What A $1000 Investment During iPhone Maker's IPO Would Be Worth Now If Held On Through The Years
2023-12-13,Why Microsoft Stock Could Run Out of Steam in 2024
2023-12-13,Why Microsoft Could Continue to Surge in 2024 (and Beyond)
2023-12-13,Oracle's Latest Results Show Cloud Slowdown Despite Expansion Efforts
2023-12-14,What's Going On With Microsoft Stock Thursday?
2023-12-14,Is Microsoft Going to $600? 1 Wall Street Analyst Thinks So.
2023-12-14,MSFT vs. AAPL: Which Stock Has More AI Upside Potential?
2023-12-15,Better AI Stock: Amazon vs. Microsoft
2023-12-15,"Microsoft Stock Can Rise 15%, Analyst Says. It’s an AI Leader."
2023-12-15,What's Going On With Microsoft Stock Friday?
2023-12-16,"2 Reasons to Buy Microsoft Stock, and 1 Reason to Sell"
2023-12-16,Forget Microsoft: Buy This Artificial Intelligence (AI) Stock Poised for a Bull Run Instead
2023-12-16,Microsoft-OpenAI collaboration under scrutiny
2023-12-17,Better Tech Stock: AMD vs. Microsoft
2023-12-17,Is Alphabet’s Gemini a Game-Changer for GOOG Stock Investors?
2023-12-17,0
2023-12-18,Microsoft (MSFT) Laps the Stock Market: Here's Why
2023-12-18,Navigating Market Uncertainty: Intrinsic Value of Microsoft Corp
2023-12-18,Microsoft’s compact Phi-2 rivals larger AI models
2023-12-19,Activision Blizzard Troubles Prompt Small Slip at Microsoft (NASDAQ:MSFT)
2023-12-19,Microsoft: Cloud Leadership Soars
2023-12-19,Is Microsoft Stock a Buy Now?
2023-12-20,5 Reasons to Avoid Microsoft (MSFT) Right Now
2023-12-20,"Microsoft Copilot Teams With Suno To Turn Your Ideas Into AI-Generated Songs, Try It Out"
2023-12-20,0
2023-12-21,You Won't Believe My Shocking Microsoft Stock Prediction for 2024
2023-12-21,"Microsoft (NASDAQ:MSFT) Stock: Top Software Play for 2024, Says Analyst"
2023-12-21,Why Microsoft Stock Is A Top Pick For 2024
2023-12-22,Analyzing Microsoft (MSFT) Gains: 2024 Buy or Sell Opportunity?
2023-12-22,Show Me The Money: Inside Ken Griffin's Citadel's Jaw-Dropping $7 Billion Return
2023-12-22,Amazon Ramps Up AI Game at AWS re:Invent to Tackle Microsoft and Google's Rise
2023-12-23,Best AI Stocks 2024: 3 to Add to Your Must-Buy List
2023-12-23,Microsoft Just Paid $76M For A Pumpkin Farm In Wisconsin — Here's Why
2023-12-23,"Dow Jones Giants Apple, Microsoft Lead Five Stocks Near Buy Points"
2023-12-24,Why These 7 Long-Term Stocks Should Be on Your Radar in 2024
2023-12-24,3 Growth Stocks to Buy in 2024 and Hold Forever
2023-12-24,These Were the 3 Best Dow Stocks in 2023. Can They Repeat in 2024?
2023-12-25,"History Says the Nasdaq Will Soar in 2024: 1 ""Magnificent Seven"" Stock to Buy Before It Does"
2023-12-25,ChatGPT picks 5 stocks to buy for start of 2024
